,Review,Review Rating,Time,Total Reviews,Business ID
2,Service was great! We walked in for take out and I ordered the fried rice with manchurian. We were the only costumers there so it was out very quickly.  My...,4,2019-10-10 21:11:28,20,NdO1fbZL1DGi_WRyV1_sgQ
0,One of my Go To places for lunch or a quick dinner when I work late. Food is healthy and delicious!  Portion sizes are large. They completely fill the...,5,2019-11-06 16:36:38,44,UiOUyzrVPTAAjNpGMFhFyQ
1,I was very impressed and satisfied with my first visit to Dill & Parsley. It is a block up from my job and was a solid alternative to the usual lunch...,5,2020-03-16 18:39:20,44,UiOUyzrVPTAAjNpGMFhFyQ
2,"I stop in here twice a week. The food is really really good, but what's equally impressive is that the people there know about the food they serve. When...",5,2020-03-10 15:37:35,44,UiOUyzrVPTAAjNpGMFhFyQ
0,favorite place. Go here all the time. Fish and rice is great.,5,2019-09-15 15:04:32,13,R2VSWR_2bNhfchNqdgQR2g
1,"The food is nice... I ordered over the phone. They delivered on time. 
I tried chicken Tikka & Aalu Muttor Gobi.
Try once guys...",4,2015-05-13 17:53:06,13,R2VSWR_2bNhfchNqdgQR2g
2,I got a chicken sandwich. They gave me a roll with pieces of chicken with bone n that's it. The place isn't very clean LOOKING. Wouldn't try again.,1,2018-09-13 14:12:00,13,R2VSWR_2bNhfchNqdgQR2g
0,"We ordered food from Anand  last Sunday for a party of 40 people.
All our guests loved the food, the fish curry, chicken and lamb kabab and Paneer  were...",5,2020-01-29 19:41:56,127,iYh7mB7PDd5ZvZZ4lFPF1w
1,"I was wandering the UES with my girlfriend, trying to find a place to eat before going to see my friend play at Session 73. We decided on Anand to try and...",1,2020-02-21 15:00:32,127,iYh7mB7PDd5ZvZZ4lFPF1w
2,"Came here for a birthday dinner with a small group, 6 in total. The restaurant was super accommodating and didn't rush us, which was refreshing for NYC....",4,2020-02-03 12:33:20,127,iYh7mB7PDd5ZvZZ4lFPF1w
0,"The Place was clean, family friendly and great for a large group gathering. I would give it 3.5 out of 5.  The Restaurant is located at 984 Coney Island Ave...",4,2018-10-02 19:03:59,91,oYiswrz5gNiZBsd3QUR9LQ
1,"I live just 5 minutes away from this place and it could be my regular joint for take-aways and for quick eat and go. Unfortunately, the food is awfully...",1,2019-12-25 18:34:38,91,oYiswrz5gNiZBsd3QUR9LQ
2,"Food is really bad. It's not even Afghani, they add too much spice and oil and it's not fresh. They rice is not afghani rice and it's not good.

Haven't...",1,2019-10-16 16:53:35,91,oYiswrz5gNiZBsd3QUR9LQ
0,"The food from Mysttik Masaala is absolutely amazing! Without a doubt, I would highly recommend you go and try the food at this cart. 

After reading all the...",5,2020-03-07 21:17:23,383,S6r0P0PItA9EYHV1nCiQgg
1,The food is always delicious! He changes the menu daily and I have enjoyed all the different vegetarian dishes I've tried. The vegetarian platter comes with...,5,2020-02-27 09:24:29,383,S6r0P0PItA9EYHV1nCiQgg
2,"Tasty, fresh, and flavorful homemade Indian cuisine. Yuvaraaj whips up many of the classics like juicy and tender Tandoori chicken but also authentic dishes...",5,2020-02-11 15:42:05,383,S6r0P0PItA9EYHV1nCiQgg
0,A friend brought me here and I wasn't expecting to like it much less love it!!  Everything is so tasty. This place was a mind blower for me because I am not...,5,2020-01-18 11:26:05,743,MAwtBgCmrY-i_jbmXlDMkw
1,"Cute place and decent service for large party.

Has a B rating, which was a red flag for me. I ordered the avocado tempeh sandwich and was sick a couple...",2,2020-02-25 10:48:50,743,MAwtBgCmrY-i_jbmXlDMkw
2,"The first day I came here I was quite hungry, so I think the food tasted better than it actually is. Service was lovely and the ginger latte was excellent...",3,2020-02-15 07:50:00,743,MAwtBgCmrY-i_jbmXlDMkw
0,This is my go to place for Indian takeout! Their daily special combination is a great deal for a great amount of food. Even though the chicken saag isn't an...,5,2020-02-20 22:22:27,133,fu5f6biOPsvgKYEfPfSZEQ
1,I ordered butter chicken and plain naan for pick-up through EatStreet and it was hot and ready right when I arrived at the estimated time! It didn't come...,4,2019-10-16 09:06:32,133,fu5f6biOPsvgKYEfPfSZEQ
2,Delicious food! A go-to takeout spot. Especially love the vegetarian options on the menu. Service is usually super fast as well. Definitely recommend!,5,2020-02-07 18:42:16,133,fu5f6biOPsvgKYEfPfSZEQ
0,"I discovered this place a few years ago. I am not sure if I can call them Poke Bowls but to me, they are Poke Bowls. My husband and I love Poke Bowls. In...",5,2019-10-29 14:00:40,104,9x95RpLEIDRWG2Y9w4qz4Q
1,"Meh. Fast casual Indian food sounded tasty. Wasn't so great, though. Unlike most Chipotle-style places, you're not customizing your order. Pick a meal, and...",2,2020-02-14 15:10:53,104,9x95RpLEIDRWG2Y9w4qz4Q
2,"1. Yelp needs to add an ""accepts cash"" category. More and more places, including this one, do not. This is discriminatory against new immigrants who don't...",2,2019-12-28 08:59:14,104,9x95RpLEIDRWG2Y9w4qz4Q
0,"We were STARVING when we decided to go here, and goodness, did we satisfy every single one of our picky tastebuds. 
We ordered a Chicken Tikka Kati Roll and...",4,2020-02-20 21:05:39,31,CX6_T61ZANH5ttfMLeKKIA
1,"Meh. 

My office just moved from Chelsea to the tip of Manhattan and I took a hard loss moving away from Indikitch. 

Was wandering around and saw this...",2,2019-06-20 21:55:42,31,CX6_T61ZANH5ttfMLeKKIA
2,I ordered via Ritual for pickup in the evening. Never had this before but gave it a shot and ordered what was most popular from other Ritual customers. I...,2,2019-04-13 10:01:46,31,CX6_T61ZANH5ttfMLeKKIA
0,This is probably the best desi food in jersey city. The food is delicious and the prices are really cheap compared to other desi restaurants in Jersey...,4,2019-11-22 16:38:22,217,DTxsUnrcAQO-OXwwypPZjQ
1,You can't go wrong with the $10 lunch buffet at Shadman. The Goat curry was really good as I kept going back for more. You can also ask for naan if you need...,3,2020-01-25 15:01:23,217,DTxsUnrcAQO-OXwwypPZjQ
2,"Pros
1. Fridays are the Best Day to Indulge in Delicious, Unlimited Rice Noodle Pudding (Kheer). It's sold on Weekends. 
2. Clean and well maintained...",5,2019-08-02 09:13:49,217,DTxsUnrcAQO-OXwwypPZjQ
0,My tonkatsu ramen was tasty and average portion-sized. The pork was tender and the broth was delicious. My sister said the veggie ramen was salty but my...,4,2019-12-30 16:40:09,285,4LVINhq3y4hCrxtShrNkYQ
1,I've come here a few times now out of convenience since they're one of the few places in this area that offers vegan ramen. I've had both the Buddha ramen...,2,2019-12-20 15:57:32,285,4LVINhq3y4hCrxtShrNkYQ
2,This was a great place to stop in for a steaming bowl on ramen on a cold night. l ordered the Momo Ramen and loved it. The broth was delicious and flavorful...,4,2019-12-12 21:29:19,285,4LVINhq3y4hCrxtShrNkYQ
0,Finding genuine organic food in NYC is pretty difficult unless you cook at home most of the time. The quality and taste was there! The Green Machine burger...,4,2020-02-10 14:31:52,441,JdNzj7EGQLC9eqqw3SYBPg
1,"I've now been here twice for dinner and love it! We got the OG Dragon Bowl, the Green Dragon Bowl, and the Green Melt sandwich. I loved my OG dragon bowl -...",5,2020-01-12 05:38:13,441,JdNzj7EGQLC9eqqw3SYBPg
2,Omg! When in Manhattan this is the best and healthiest place to eat for compassionate healthy food served artfully by an amazing and dedicated staff. Bless...,5,2019-11-21 22:45:52,441,JdNzj7EGQLC9eqqw3SYBPg
0,I'd give this place 10 stars if I could! I loved everything from the quaint inside to the atmosphere to the customer service and don't even get me started...,5,2019-11-28 21:18:40,364,jE5_yPypanQLdYe7-f__dA
1,"Toad Style is a very small place in Bed Stuy who offers a variety of vegan food made in different ways. It has a good vibe nd decoration, kinda rebel style....",3,2020-01-03 11:48:16,364,jE5_yPypanQLdYe7-f__dA
2,"customer service ****
Came in for a pickup order. Got the bbq jackfruit sandwich. I saw on the door some lunch special that included a side salad or fries....",3,2019-10-14 13:13:25,364,jE5_yPypanQLdYe7-f__dA
0,"This place was a BOMB discovery after a hard fitness class! All vegan good stuff when I'm in NYC will be had here!

I had the Kale ceasar with shitake bacon...",5,2020-02-27 17:55:10,777,CEEUDBFxvUPKGlA65qJ8JQ
1,"Prettttty Prettttyy Prettyyy Good! (In my best Larry David voice).

I enjoyed eating here, came here randomly with a friend and I'm glad I did. First I'll...",4,2020-02-20 12:19:00,777,CEEUDBFxvUPKGlA65qJ8JQ
2,Food: delicious  (I was craving the Quinoa Taco salad again...) I should've gotten some air fried potato fries to fill me up. The sauces never disappoint...,5,2020-02-19 15:55:11,777,CEEUDBFxvUPKGlA65qJ8JQ
0,"So happy I paid a visit to the VSpot in my home city Brooklyn, NY. It's located in the trendy neighborhood of Park Slope. Close to Barclays Center, mores...",5,2020-02-13 13:48:26,679,sDgN-TGeEz-wd8kWEUWwTA
1,"so in april i got 3 $10 gift certificates here, since april i have been calling this location trying to find out if im able to use them on delivery, no...",2,2020-01-07 17:06:34,679,sDgN-TGeEz-wd8kWEUWwTA
2,"I've come here a handful of times over the past couple of years, and if it wasn't a little out of the way of my usual travels, I would come here much more...",4,2019-10-28 15:28:55,679,sDgN-TGeEz-wd8kWEUWwTA
0,This is the best halal in NYC hands down. Does anyone know where I can buy a giftcard to support during COVID?,5,2020-03-29 06:48:57,247,Rr55bXbJcfdm4lIf-1f0Qw
1,This was my go-to spot for chicken over rice.  But I haven't seen it in months.  Has this cart moved or stopped operating?,4,2020-03-04 08:28:07,247,Rr55bXbJcfdm4lIf-1f0Qw
2,"The Kwik Meal Cart is such a wonderful addition to the neighborhood. I say that like it's a new establishment, but no they've been there for years and with...",4,2018-09-15 11:20:26,247,Rr55bXbJcfdm4lIf-1f0Qw
0,"Wednesday 11/6/19 @ 2 p.m.
Stopped in and was greeted warmly and friendly by the staff as if I were missed and family.
I picked up takeout.
Lamb and Okra...",4,2019-11-06 13:29:13,43,U45dUNzVKs2KlM5HRgbDGA
1,"Truly a basic Mediterranean food hall for the mass. But seriously a $16 for a dish of lamb and rice. :(

I was excited to come here for a quick bite because...",4,2019-03-17 13:54:14,43,U45dUNzVKs2KlM5HRgbDGA
2,I can't argue with $7 pita sandwiches (with white sauce) and $1 baklava. You can also get a pint of hummus for $5.,5,2018-06-29 22:17:05,43,U45dUNzVKs2KlM5HRgbDGA
0,This review might be harsh for a new place but they are in a VERY competitive neighborhood and need to improve significantly from what I experience a couple...,1,2019-10-06 11:19:08,3,OpXv1wV4PvTlzzBEEPSItg
1,"Not sure if there is an option that I could give 0 or negative rating, never ever try this restaurant. I have an office party and I am responsible for...",1,2020-01-03 12:55:37,3,OpXv1wV4PvTlzzBEEPSItg
2,Doesn't look like much when you pass by. It's a small new restaurant. Never noticed before. I popped in and ordered to take out hot and sour soup and triple...,4,2019-12-15 14:47:55,3,OpXv1wV4PvTlzzBEEPSItg
0,"Their food is really yummy and delicious. They have any options. My recommendation is starting with tasty appetizers. Beside that, Lentil soup is great",5,2020-03-03 13:24:53,322,80YK6JElg_pHjlHLlOvkmw
1,"I'm not inclined to return, period.
Upon entrance, atmosphere was bright and bland.
The woman who took our order barely cracked a smile. Nevertheless, bread...",2,2020-02-22 08:55:18,322,80YK6JElg_pHjlHLlOvkmw
2,"Ordered delivery, once, and most likely will not be ordering again.  Let me share with you why... 

While delivery was on time and efficient, their was...",2,2018-12-26 16:23:48,322,80YK6JElg_pHjlHLlOvkmw
0,This place is amazing.i went there with my family and everyone like food so much. It's taste authentic Indian food. Best Indian food in USA. Highly recommended.,5,2019-09-11 18:39:35,2,busL3obPpNkF5a9ISfO5wQ
1,"Doesn't cut out the deal of a real Pakistani place. 

Kebabs - lame flavors, ain't no good spice flavors tingling my tongue here. Bihari and chapali kebab...",2,2019-04-21 07:35:26,2,busL3obPpNkF5a9ISfO5wQ
0,"This is probably the 3rd Indian restaurant I've seen in this based, but this is the 1st time I felt compelled to go inside. The décor is clean and...",4,2020-03-05 21:25:25,6,LC5qKRk3zy7f1eTONkSd3A
1,I stumbled upon this place by chance. My GF and I were on our way to grab pizza but saw this restaurant had recently opened. We sat down and enjoyed a great...,5,2019-10-20 15:14:34,6,LC5qKRk3zy7f1eTONkSd3A
2,"Excellent food. Classy atmosphere. 
Very fast service. Very clean place. 
Wonderful flavorful sauces and curries.",5,2019-11-15 18:34:57,6,LC5qKRk3zy7f1eTONkSd3A
0,"allow for time as they prepare the food your order. it's worth the wait! the food is fresh, delicious and the staff is friendly. the lady guided me thru the...",4,2016-07-17 08:31:35,34,yqKzYJHASzNlytsMUmyAsw
1,"Dishonest business. Their food truck is disgusting. I ordered 2 chicken tikka kati rolls, then the next guy orders a pepper chicken kati roll. I watched...",1,2020-02-22 15:58:46,34,yqKzYJHASzNlytsMUmyAsw
2,Not that great. Ordered chicken biryani and raita. Nothing special. Cheapef out on ingredients.,3,2019-12-23 18:27:19,34,yqKzYJHASzNlytsMUmyAsw
0,My go to place. Remind me of Surat  in two ways- one for cold coco and another hundreds of delicious egg dishes.,5,2020-01-15 19:46:57,292,HM7Mz6Hpxts58JJP7qELNQ
1,"Have been here 4 times now, its a must visit whenever we go to NJ. Love the Volcano Biryani and Surti gotalo. You can even ask them to make your dish spicy...",4,2020-03-05 13:19:15,292,HM7Mz6Hpxts58JJP7qELNQ
2,"I have been here so many times, but it's taken me so long to review them because I never get a chance to take pics once the food arrives. Everyone downs the...",5,2019-09-15 10:39:10,292,HM7Mz6Hpxts58JJP7qELNQ
0,"We have been coming to Amiya since it opened at its old location. The main difference at the new is a bar, more modern decor, brighter lighting (less of a...",5,2020-02-08 17:26:07,353,T5aGLWBjIZoV0pSW80nJXA
1,Services fast and attentive. Presentation of dishes were wonderful. Atmosphere and interior is modern and clean. Complementary papadum with two chutney...,3,2020-01-26 18:38:42,353,T5aGLWBjIZoV0pSW80nJXA
2,The waiter came back with what looked like watered down iced tea when my friend ordered Coke.  When I called the waiter over for an exchange he seemed upset...,2,2020-01-12 12:21:42,353,T5aGLWBjIZoV0pSW80nJXA
0,"I went because I was walking by, en route to church. I did not know about the late Anthony Bourdain raving about this place.

I ate a pastrami-corned beef...",5,2020-01-12 16:25:11,511,oSpBTTBYy_sWDXiZF5CSdg
1,"The appeal of this place must be cultural.
I guess if you grow up eating this as some sort of treat maybe your brain remembers it that way.

To me the...",2,2020-01-16 11:58:51,511,oSpBTTBYy_sWDXiZF5CSdg
2,"Made the trek to the Upper East Side to try Pastrami Queen based on the illustrious words of Anthony Bourdain- as I'm sure many others have as well.

We...",5,2019-12-10 08:33:38,511,oSpBTTBYy_sWDXiZF5CSdg
0,"I wonder what is so exclusive about this place.

Malika is nice enough.  The place is big and roomy and almost never crowded.  For lunch, there is a buffet....",3,2007-04-19 12:11:03,2,shNn0uGXQBD7wEIhbtzeIg
1,"Lower your expectations. The tasty food was sadly overshadowed by the extremely slow service, inconsiderate host and blatant padding of the bill. A blaring...",2,2008-05-17 19:47:32,2,shNn0uGXQBD7wEIhbtzeIg
0,This is a small Indo-Pak restaurant with exactly the same vibe if you know what I mean. The food is exactly like the place back home where you would hang...,5,2019-12-07 11:37:30,18,phEamT8HRnu-RFFoCbJ5Bg
1,"Hidden gem still for the most part! Though it is getting more popular day by day.

Food is probably the most authentic North Indian cuisine you can get on...",4,2019-02-11 20:57:52,18,phEamT8HRnu-RFFoCbJ5Bg
2,"It's hidden gem restaurant in jersey city.. I have been going to them since 5 years now. They have started at new location close to Indian st. Best, finger...",5,2020-01-19 13:52:14,18,phEamT8HRnu-RFFoCbJ5Bg
0,"I had delivery from Dao tonight, I ordered the cold green tea noodles, Pho, and seitan satay skewers. The Pho really hit the spot, they were very generous...",5,2019-10-27 17:17:26,233,DsW8a9zwKWXBA_xOqKO-yQ
1,This was by far the worst experience I have had here. Service is always petulant and slow with the younger staff but today the food was poor as well. The...,2,2020-02-10 08:10:19,233,DsW8a9zwKWXBA_xOqKO-yQ
2,"Service was blah... For there to only be, maybe, three other customers outside of my friend and me, they seemed lackadaisical when it came to taking our...",3,2019-04-18 14:45:39,233,DsW8a9zwKWXBA_xOqKO-yQ
0,"This place is good and I definitely advice anyone to go. If you go do not ""FORGET""!! the. ""the MALAI-KULFI""!!!  OMG!! It is the best ice cream cold with ice...",5,2016-11-25 08:22:42,21,VLQrI-Qua7Ok02fAAuwvAA
1,It's always been a challenge to find quality Indian / Pakistani fare in these parts; Brooklyn just doesn't have the abundance of quality establishments as...,3,2018-08-20 23:59:30,21,VLQrI-Qua7Ok02fAAuwvAA
2,"Best Falooda in NYC hands down, cant speak to the rest of menu because only reason I trek out to Brooklyn is for the falooda from here. Must Try!",5,2019-06-20 10:04:09,21,VLQrI-Qua7Ok02fAAuwvAA
0,"The food is absolutely delicious! We ordered quite a few appetizers, but the samosas were the best part! We then ordered different entrees and goat briyani,...",5,2019-12-28 19:39:18,109,MAjVFhRwxbOsMHLkObzh4Q
1,"This place is cheap so have added a star for prices. But food quality, taste is bad. 
I ordered chinese bhel (4.50$) , have attached a picture. It was all...",2,2019-12-31 20:29:25,109,MAjVFhRwxbOsMHLkObzh4Q
2,"Stale cold food with artificial color.. not recommend all.
I tried chicken lollypop and cauliflower manchurian",1,2020-04-08 07:26:06,109,MAjVFhRwxbOsMHLkObzh4Q
0,"Reading other reviews, I think most complaints must be centered around delivery, because there's a lot of complaints about it being soggy, or cold, etc....",4,2019-12-20 07:32:35,116,o8KtWVBIVI9E3YYM5r0dPw
1,We ordered falafel sandwiches for delivery and they arrived ice cold inside and out. When we called to complain they told us it's supposed to be that way....,1,2020-03-06 17:16:26,116,o8KtWVBIVI9E3YYM5r0dPw
2,"Love them. Delicious, affordable, not your average falafel, they actually dress it with real middle eastern salads not just lettuce and tomato.",5,2020-02-11 11:41:34,116,o8KtWVBIVI9E3YYM5r0dPw
0,Excellent vegetarian spot in Chinatown. Nice environment inside (outdated in a nice way). The food comes out quick and there are lots of options for meat...,4,2020-02-14 04:49:13,552,rGmGim1ZDCxnF8n4NiKrYQ
1,"Picked this spot on a post lunchtime window Saturday afternoon. The place serves all vegetarian items even though the menu says ""Chicken"". The ambiance is...",3,2020-01-12 22:00:06,552,rGmGim1ZDCxnF8n4NiKrYQ
2,"We had a really delicious birthday dinner here a while ago that I keep meaning to write a review for. The rice rolls with Chinese kale, turnip cakes, and...",5,2020-03-25 09:43:10,552,rGmGim1ZDCxnF8n4NiKrYQ
0,Locals of the area may remember this spot as the woeful Bonoful (http://www.yelp.com/biz/bonoful-restaurants-and-sweets-astoria) which if not for it's...,2,2010-09-17 17:33:12,4,L02D3DmTwrkap-BaAfIg8g
1,"I really wanted to love this place because I live right around the corner.

The chicken vindaloo tasted ok until I realized the chicken chunks had bone in...",2,2012-06-19 11:46:06,4,L02D3DmTwrkap-BaAfIg8g
2,"Been here twice for takeout; both times, food is good.

Yesterday, Chix tikka masala was served w/ a large plate of light basmati rice, some salad and...",4,2010-12-04 12:44:34,4,L02D3DmTwrkap-BaAfIg8g
0,"I went here on an early saturday morning.  I had a chicken kabob skewer wrap and it was awesome. The flatbread was freshly baked in the tandoor oven.

This...",5,2019-10-25 10:20:46,161,AiZhCGPJeLm8T1fvdYdbKQ
1,A great place to grab a cup of tea and a snack. They have a number of lunch/dinner options as well. I love coming here mostly because you come across people...,5,2019-09-03 09:15:42,161,AiZhCGPJeLm8T1fvdYdbKQ
2,New ownership and my how different. Very friendly staff and service.  The food is excellent with very generous portions.  Bearing in mind this is an under...,4,2018-12-28 21:42:26,161,AiZhCGPJeLm8T1fvdYdbKQ
0,"Love this place

Its really hard for me to find somewhere that i dont get sick of eating often when i need a quick meal in between my jobs but here always...",5,2020-03-01 14:30:57,639,dzI6MzwKbrhJN5dEeUbX0w
1,"This review is about a bad situation that happened with the delivery. The food was great, but I think most reviews make that clear.

This was supposed to be...",2,2020-04-03 17:44:56,639,dzI6MzwKbrhJN5dEeUbX0w
2,"Falafel sandwich to go was just awful yesterday. 
The falafel were cold and hard as rocks. 
I was reluctant to have hummus on my pita, all the flavors in...",2,2020-01-31 09:39:59,639,dzI6MzwKbrhJN5dEeUbX0w
0,"It was delicious, but I had a heartburn after a few hours. It was my first experience with Indian food and I like it. The stuff is very friendly.",4,2020-03-05 18:19:19,43,ujKLiI39ie5K_iB-TLaFMg
1,"This happened last time (week and half back) when I took out a 3 idly meal (comes with sides - three chutney and sambhar), the amount of the chutneys given...",1,2019-11-23 15:04:14,43,ujKLiI39ie5K_iB-TLaFMg
2,I ordered the paneer masala dosa. Dosa is an Indian crepe made from various lentils and rice. It's usually very crisp and savory; stuffed with a delicious...,3,2019-09-15 12:07:19,43,ujKLiI39ie5K_iB-TLaFMg
0,"Wanted a quick bite in the area, and the previous yelpers reviews definitely convinced me that I needed to try.
I ordered the beast, which I referred to as...",5,2020-02-16 11:51:59,532,jpw7iGUzsj_AECKt351X8w
1,"This is one of those places that everyone talks about so you must visit.   

First of all the wait was ridiculous, over priced and okay service. FYI; no...",2,2020-03-13 22:19:20,532,jpw7iGUzsj_AECKt351X8w
2,"i was here with my cousins and brother and we ordered 4 sandwiches and 2 sides to share among the 6 of us. We ordered 2 howlings, 1 carnivore's delight, 1...",3,2020-03-10 19:11:44,532,jpw7iGUzsj_AECKt351X8w
0,I've been ordering the same Tropical Green smoothie with extra ginger for 7 years. This place has always been a diamond in the rough! Food always has great...,5,2019-10-12 23:32:16,190,xhWqjDuoORYBVgZVc4uK3g
1,My roommate comes here often but my experience is bad! I came for the sea moss drink they have in their fridge and she said they were out i asked when they...,3,2019-08-28 11:05:11,190,xhWqjDuoORYBVgZVc4uK3g
2,Update: the second time I went the food was absolutely dreadful. The soup taste so burned i couldn't finish it. The rice was so mushy the only thing i ate...,3,2019-02-26 13:35:06,190,xhWqjDuoORYBVgZVc4uK3g
0,My eyes went all agog when I bounced in here for the first time around 330p today to pick up a meal (linner? dunch?). I suspect they gave my paneer-white...,5,2010-10-01 14:19:58,4,oWmHgBlcY9yNgjUo7mNX4Q
1,"Quite honestly, when I want Indian food, I make it myself, because nobody else makes it as well, but I'm SO pleased to find that these folks have a fresh...",4,2010-06-30 18:46:17,4,oWmHgBlcY9yNgjUo7mNX4Q
2,"Good find. They just opened up this week, and I must say that's quite a ballsy move considering that Punjabi Dhaba is across the street. But they've got...",4,2010-04-10 11:27:40,4,oWmHgBlcY9yNgjUo7mNX4Q
0,"Soul Curry was my first real experience with Indian food and oh my god did it not let me down - in fact, it stirred something in me, bringing this whole new...",5,2020-01-12 07:29:07,112,ggLd3EdBQxHK7IQHnY_hhg
1,"While I loved Karma Kafe, I was glad to see another Indian restaurant arrive in Hoboken.  A few friends gave me positive feedback on Soul Curry, so I knew...",4,2020-03-19 07:30:24,112,ggLd3EdBQxHK7IQHnY_hhg
2,My fiancé and I have been wanting to try Soul Curry for a while. So when I saw they were participating in Hudson Restaurant Week and it was $19 for three...,2,2020-02-07 05:21:46,112,ggLd3EdBQxHK7IQHnY_hhg
0,"For everyone who used to love Bengali Sweet House's weekend buffet and noticed a drop off in quality, it's because the original caterers moved here! They've...",5,2019-06-01 11:14:09,36,--IdKkia9zPNgB-rQreyBQ
1,The live pani puri station feels like you're in India! I usually don't eat pani puri but this was so good! I ate each one! Definitely worth it! They said...,5,2019-02-18 11:45:03,36,--IdKkia9zPNgB-rQreyBQ
2,Trash food. I went to this place with my wife. It ruined our Saturday night. Food was served cold and the service was equally bad (Ps a lady server saw our...,1,2020-01-25 14:30:11,36,--IdKkia9zPNgB-rQreyBQ
0,"Great employees make the food even more tasty!
Yes what a nice experience... two gentlemen working both super efficient and very nice..
One of them even...",5,2019-11-30 18:10:18,169,3Wu7lGDEwuP-5OW1rdg0OQ
1,"I'm kinda disappointed. Came here yesterday to grab some Sammy's last night after the fight. Coming from Stamford, I was really looking forward to it....",2,2019-11-03 19:25:34,169,3Wu7lGDEwuP-5OW1rdg0OQ
2,"Such an affordable, delicious, and filling lunch option! 

The staff are super nice and they remember you and your order which is great for customer...",5,2019-08-23 14:00:43,169,3Wu7lGDEwuP-5OW1rdg0OQ
0,decent indian food delivery for those of us living in the culinary wasteland of the financial district.  paneer tikka masala & chicken tikka masala are good...,3,2008-02-19 09:09:13,1,pzVUUB9bXZMK8KvRLOoUWg
