,Review,Review Rating,Time,Total Reviews,Business ID
1,"This is a new place in Williamsburg and I was there for lunch on Christmas Eve. The place was pretty empty as expected, and we enjoyed a quiet time and good...",4,2018-12-30 08:17:58,148,BKABojUN3G9vUrG3AlDZgQ
2,"Found this spot in Yelp. The whole restaurant is vegan Thai/Chinese food. I'm not much into vegan food, but my friends are and this place was perfect. TBH...",4,2019-11-03 18:54:13,148,BKABojUN3G9vUrG3AlDZgQ
0,"It feels like you are in yemen.
No fancy menu or interior ,mostly men Speaking loudly lol.
When you order the server sometime he yells For the item...",5,2018-09-28 20:18:45,77,blDT9_3bnnWAwtBAODIENA
1,"The name is short, simple and apt. It's a no frills, no nonsense Yemen cuisine restaurant, and presumably authentic since few patrons/staff speak English...",5,2018-06-05 16:29:26,77,blDT9_3bnnWAwtBAODIENA
2,"Found another neighborhood Gem!!
They moved here to Bay Ridge from Court St. Not a very pretty place nor a place where a woman, alone, might feel that...",5,2017-11-04 10:21:26,77,blDT9_3bnnWAwtBAODIENA
0,Izzy's is an island of Texas in Crown Heights Brooklyn. How amazed was I that there could be great kosher BBQ (that is not an oxymoron) with a Texas style...,5,2019-11-01 08:09:28,146,37RhWHnMsnjULuoN95Bg9A
1,"If you're craving meat this is your place! 
I've tried their fried chicken sandwich which is huge!!!!!! It's really good but I think next time I would ask...",3,2019-11-15 05:36:00,146,37RhWHnMsnjULuoN95Bg9A
2,Was so excited to try this place based on the reviews. For starters walked in and took a while to be greeted. That's fine seemed like there was only one...,3,2019-11-04 13:26:43,146,37RhWHnMsnjULuoN95Bg9A
0,"This location was good, not the best I had been to but the food was still good.

It's a small location but they often are, they weren't the fastest or...",4,2020-02-20 06:22:23,326,KbCLZOKvPdNY7ptAg0kGxw
1,"My friend had catered kati rolls from this particular Kati Roll Company, and I more or less went on a marathon of trying out different types of rolls....",4,2020-02-09 14:23:28,326,KbCLZOKvPdNY7ptAg0kGxw
2,My mouth just got face F***ed with flavors! The Kosha Mangsho roll with slow braised goat and red onion is to dye for.  Get two rolls for a meal or one for...,5,2020-02-26 17:43:29,326,KbCLZOKvPdNY7ptAg0kGxw
0,"Two friends and myself went here on Sunday and although we spent a little longer than anticipated here, I had a great time. They were extremely busy and...",3,2016-04-21 07:50:44,83,R0FryAIetxATjdYwOdy1aQ
1,"This place is staffed by imbeciles ! After waiting an hour for my delivery, I called to find that my food hadn't even been made and the person on the phone...",1,2019-11-16 12:44:09,83,R0FryAIetxATjdYwOdy1aQ
2,"No matter what Indian restaurant I go to, I always get the same thing - chicken tikka masala and shrimp biryani. So, I've had a pretty good range of taste...",1,2018-12-12 00:38:07,83,R0FryAIetxATjdYwOdy1aQ
0,"THE BEST KATI ROLL EVER

I've had my fair share of experiences with different places that serve Kati rolls and this place has the BEST I've had. Whenever...",5,2019-12-09 20:18:37,484,mZALre3ahuetu5X8_uUJew
1,"I had the Gobi Paneer but thought it was quite boring.
All I tasted were the eggy-like paneer and onion. Can't really tell if there's cauliflower inside...",3,2020-03-13 19:49:35,484,mZALre3ahuetu5X8_uUJew
2,"Thelewala is a small joint located on Mcdougal. The place is usually bustling with people who want a quick Indian meal. ""thelewala"" essentially means food...",4,2020-02-19 08:00:14,484,mZALre3ahuetu5X8_uUJew
0,"The Quick: How is this place vegan? A vegan french place... With Incredible vegan steak tartare, cheese plate, and more. Small charming spot, make...",5,2020-03-16 07:54:18,399,3PabSEZ2ESexVFZznyozVw
1,Overall I was pretty satisfied with my first visit to this restaurant. This was my first time trying French food as a vegan and it was really good! I went...,4,2020-01-19 21:46:17,399,3PabSEZ2ESexVFZznyozVw
2,"I'm a big fan.  I've taken several vegetarian friends here, and they always love it.  For starters, our favorites are the foie gras and the escargots.  I've...",5,2020-01-06 22:13:24,399,3PabSEZ2ESexVFZznyozVw
0,For all the Indian food purist haters out there this isn't anything like your average curry shop. Nor is it an afterthought of a concept that's desperately...,5,2020-03-17 14:28:28,348,_nScWpFX3M1K7s30hFEsRw
1,"Sick of Chipotle but still want to build your own bowl?
Inday can do that for you with all of the spice and everything nice.

They have several pre-crafted...",4,2020-02-17 16:23:38,348,_nScWpFX3M1K7s30hFEsRw
2,"Ordered online through Yelp and was able to skip the line and pick up my order instantly. 
I'll definitely be back and ordering online again as there always...",5,2020-01-30 21:31:55,348,_nScWpFX3M1K7s30hFEsRw
0,This review is long overdue. Best indian food ever if you are craving home cooked mother like meal.  My office is a block away so naturally I acome here...,5,2019-11-13 04:01:56,110,nQfPwIasXCi8NwNKq65vfw
1,"Very good food cart that serves authentic Indian food. The infusion of spices in the chicken biryani was on point. Great value in their platters for $10,...",5,2019-11-13 12:02:49,110,nQfPwIasXCi8NwNKq65vfw
2,"Cheap and cheerful.   Great Indian food that offers plenty of vegan options. 

Located on the corner of Park and 47th on the west side of the street.   A...",5,2019-03-04 11:28:47,110,nQfPwIasXCi8NwNKq65vfw
0,"I have been to this restaurant many times over the years. It has rarely disappointed (other than the buffet which I tried once).

We came here for dinner (4...",4,2019-10-15 12:22:10,547,nd0uXNXaeaDMuMk4C1GusA
1,"For all those people who want a taste of delhi food - go here 

Order

Kabab platter

Butter chicken

Dal makhani

Garlic naan

Scrumptious!!!!

One extra...",5,2019-12-24 17:19:40,547,nd0uXNXaeaDMuMk4C1GusA
2,"Another ""stumble on"", we visited Bukhara Grill towards the end of the evening.  Things started out alright as they quickly brought us water and a...",2,2018-08-24 20:07:27,547,nd0uXNXaeaDMuMk4C1GusA
0,"So far the Best Quality of Indian Buffet in Jersey City so far!!

Pros
1. $12.00 All You Can Eat is Awesome.
2. The Interior has a Luxury Residential Vibe...",4,2019-11-18 13:44:43,218,yC-GsIbqeQnoVd9LYiOabQ
1,"Gross Cheap frozen wings ( dark old meat) marinated in sauces and heated to called appetizers. Shame on you!!!!

This was really bad experience, the quality...",1,2020-01-02 20:01:13,218,yC-GsIbqeQnoVd9LYiOabQ
2,"Came here on a Saturday night and was able to get seated immediately. Service was friendly and quick. We ordered:

Lamb rogan josh: tender pieces of lamb in...",4,2019-07-14 08:26:05,218,yC-GsIbqeQnoVd9LYiOabQ
0,"I recently stayed with a friend in Greenpoint for a few weeks while my apartment in Manhattan was undergoing renovations.

I arrived late my first night and...",5,2019-12-13 20:56:45,52,xnrn6Ibn4T22vTjYX1H1zQ
1,"It wasn't great, it wasn't terrible. It was a decent tasting, decent priced lunch special in Greenpoint. I had the Afghan veggie eggplant and my boyfriend...",3,2020-02-24 18:50:56,52,xnrn6Ibn4T22vTjYX1H1zQ
2,"PURCHASED: Meat Somosa ($5) + Naan ($2.50) + Lamb over Rice ($10-ish)
COSTS: $17.50 

PROS: 
+ 4/5 delivery time: Delivered a total of 15 minutes earlier...",2,2019-04-23 21:27:55,52,xnrn6Ibn4T22vTjYX1H1zQ
0,"Simply, the best. It's that undeniable combination of spice and flavor that sets this establishment apart not from only other food carts, but from many...",5,2020-03-17 18:33:11,50,NztBFASX-zzg0tROoLiKOg
1,Haven't seen him in a while as it is winter. During the summer months he's always by Duane reade and his food is delicious!,4,2018-12-27 21:52:37,50,NztBFASX-zzg0tROoLiKOg
2,Wow. I always passed this food truck but today I stopped. I'm so glad that I did. The man working in the truck was super sweet. He gave us a free sample....,5,2016-01-22 18:25:12,50,NztBFASX-zzg0tROoLiKOg
0,I wanted to try this spot but thought it was out of the way until I actually googled how to get there. Thankfully the B43 stops 1 block away. I decided to...,3,2020-01-25 06:23:15,18,KDr72efaFAcQXccdA4yoaw
1,"I have very limited experience with West Indian food, so admittedly probably not the best person to ask about this cuisine, but I really enjoyed my meal...",5,2019-07-12 13:35:33,18,KDr72efaFAcQXccdA4yoaw
2,A friend lives nearby and we were hungry. We walked in a 9pm and were made to feel welcomed and the chef/owner fixed us up a few plates of...,4,2019-04-06 05:12:14,18,KDr72efaFAcQXccdA4yoaw
0,"Their vegetables are fantastic! I always have trouble deciding which ones I want, because they have many and they're all delicious. 
Their hamburgers are...",5,2020-03-23 10:09:53,930,55spA8dSOvKRme3ix-k7gg
1,"Variety of vegetarian options on the menu: 4/5

Dropped by this spot while on a work trip to New York; there are several around the city and heard from my...",4,2020-03-05 13:15:43,930,55spA8dSOvKRme3ix-k7gg
2,"Great.  And great again.  My most recent trip to W.W. was just forty-eight hours ago, when I and my date came for an easy quick dinner.  I'd een there twice...",5,2020-02-16 16:50:04,930,55spA8dSOvKRme3ix-k7gg
0,Decent place for brunch. For $15 you get plenty of vegetarian and meat/ non-vegetarian options on a weekday. Their lamb biryani and upma are excellent....,4,2020-03-04 10:02:42,168,u_j2PopX_tFfQvrlerjmmA
1,"Pros
1. The Ambience was Modern yet Woodsy feel.
2. Friendly services.
3. Tandoor Hachari (Baked Chicken was so Flavorful and the Chicken's gravy was...",4,2019-11-23 15:34:06,168,u_j2PopX_tFfQvrlerjmmA
2,I was looking for unique food that could be delivered as I was staying at a hotel in Newark and didn't want to leave. I found Golconda Chimney because it...,4,2019-08-11 23:51:04,168,u_j2PopX_tFfQvrlerjmmA
0,I passed by this restaurant in the neighborhood and finally we came over for brunch.  I love all the little decorations in the place and I was told the menu...,5,2019-12-29 14:06:08,78,HwEc9t8vV_DPCyFe3tVJ2Q
1,"Came here after a long day of studying for finals across the street at Fiction Coffee (also highly recommend). It's very dim lit with a cozy, vinatge vibe...",4,2019-12-11 18:35:36,78,HwEc9t8vV_DPCyFe3tVJ2Q
2,"If a dish is 50% comprised of onions, why WHY would you not include it on the menu description??? In order to avoid garlic, onion, and any indication of...",3,2019-09-20 19:27:03,78,HwEc9t8vV_DPCyFe3tVJ2Q
0,"I have been to different locations of this place and the taste is consistent. 
I have tried different live feasts - mushroom and paneer based as well as...",4,2019-12-12 20:06:20,58,ItocvsIyniVxMARBkHZaoA
1,Worst service from both the restaurant and grub hub. Waited for my order for 2 hours after which I called support and they said the order has been cancelled...,1,2020-03-01 13:36:46,58,ItocvsIyniVxMARBkHZaoA
2,"It use to be a good place but now after the name change from indiKitch to Deep, its just going down!
Food was mediocre and the brown rice were half cooked!...",2,2020-01-20 16:30:59,58,ItocvsIyniVxMARBkHZaoA
0,"This is one of my go-to restaurants, hands down. It took me a few tries from trying out a few other Indian restaurants before I discovered this wonderful...",4,2019-11-15 19:46:50,118,lTKwlr9_vWjNDPbt4I7bog
1,My god! How do people like this food? I was hungry AF and went to their buffet thinking that I'd like anything when I'm starving but the experience has been...,2,2019-09-27 12:35:54,118,lTKwlr9_vWjNDPbt4I7bog
2,I have been going to Chaska for over 8 plus years.I introduced all my friends and family and they love the food. The food and taste quality has always been...,5,2020-02-25 14:52:38,118,lTKwlr9_vWjNDPbt4I7bog
0,"Banana Boat has many choices in its pay-by-pound buffet. As of October 2019, the baseline price was $6.79, with the usual meat-only upcharges. The must-have...",5,2019-10-14 21:42:33,14,tHY4jNvSgdIYoWnE9b7IZg
1,Great Jamaican breakfast! This is wear I get my fix since I haven't learned any of the recipes from my mom yet. The cornmeal porridge is amazing!,4,2020-01-10 18:17:04,14,tHY4jNvSgdIYoWnE9b7IZg
2,"If you need some quick, healthy, veggie-friendly options in BK, head over! It's a buffet so realize some options could use a little more seasoning than...",3,2019-09-02 10:11:52,14,tHY4jNvSgdIYoWnE9b7IZg
0,"Let me start this by saying I'm not vegan, nor do I really even have much enthusiasm for anything plant based or vegetable related. 

However I was...",5,2020-02-04 02:14:39,377,S7ivv5O0beH3U9cV3cRD_Q
1,"If you aren't a vegan person your first thought might be ""vegan Asian Fusion.. sounds weird"" however, this isn't weird at all. I stopped by with some...",4,2020-03-01 06:56:20,377,S7ivv5O0beH3U9cV3cRD_Q
2,"The vegan experiment continues ... the goal is to sustain a ""healthy vegan diet"" that is enjoyable at the same time. The last restaurant was Jamaican and...",4,2020-02-22 14:55:26,377,S7ivv5O0beH3U9cV3cRD_Q
0,"ADD THIS TO YOUR NYC HALAL BUCKET LIST

Holy Cow perfects the burger the way it was supposed to be made. The buns are perfectly crisp, warm, and never...",5,2020-04-09 15:56:34,249,8mmM20X369_Do04kW7-TTA
1,"Probably one of the best chicken burgers I've ever had. I've had the holy burger and classic burger too, but the holy chicken is where it's at. Probably has...",4,2020-01-11 17:46:10,249,8mmM20X369_Do04kW7-TTA
2,"Called in for a pick up order on a Saturday night - the people who work here are so sweet & awesome!

Got the impossible burger w/ a side of fries. The...",5,2019-12-29 22:27:26,249,8mmM20X369_Do04kW7-TTA
0,Great value deal and super flavorful food. We were walking in the neighborhood and stumbled across this hidden gem. We are suckers for fresh and good...,5,2020-03-24 19:39:57,31,2YufTvP05BC9VORwAcOl_g
1,"This place is incredible! The ambience is no frills but the food is very good, very flavorful and tasty Pakistani food, and the service is super quick too!...",5,2020-02-10 17:48:37,31,2YufTvP05BC9VORwAcOl_g
2,This place has  rice and kabobs and chicken dishes and it's like a fast food joint.  We literally ordered one of everything to go. I was ok with that since...,4,2019-11-25 09:56:07,31,2YufTvP05BC9VORwAcOl_g
0,"We have The Halal Guys locations in my hometown, but of course we have to try the food truck version in NY! They are open late and it is sooo delicious...",5,2020-04-07 01:29:58,9439,xEnNFXtMLDF5kZDxfaCJgA
1,"So, in light of what's happening in NYC with the Covid-19 pandemic, I thought this would be the perfect time to give NYC a lot of love. We vacationed here...",5,2020-04-04 22:55:39,9439,xEnNFXtMLDF5kZDxfaCJgA
2,"First timing visiting early evening with few people ahead of us. 

We have one in Toronto but this cart is something else. It's a loaded combo and the price...",5,2020-03-21 20:08:46,9439,xEnNFXtMLDF5kZDxfaCJgA
0,"Absolutely love this food cart!

The quality of the food is just so good and delicious! 
I have had a conversation with the owner, Yuvaraaj and he really...",5,2017-11-29 16:23:43,10,kNzjRlXzL5XJInDqNwfMgA
1,"I've checked out the food truck on Ditmars and it looked great, so I was excited to finally try the food at Mysttik Masaala (I decided to go for the one on...",4,2019-09-06 08:31:14,10,kNzjRlXzL5XJInDqNwfMgA
2,"I came across this food cart and was super impressed by freshness of the vegetables, lightness of the sauces, and spicy authentic flavors. Oh, and the fact...",4,2018-12-17 08:50:50,10,kNzjRlXzL5XJInDqNwfMgA
0,"I enjoyed my lunch today with my friend
The staff are amazing and friendly 
The food is so delicious and tasty
They have a cozy and toasted environment...",5,2020-02-29 14:02:38,420,ugYhnKrr3Q1TVV15R0EEWQ
1,"The baklava was very sweet but won't make you feel uncomfortable; also comes with flaky layers, would highly recommend this one if you're a sweet dessert...",3,2020-01-25 21:02:26,420,ugYhnKrr3Q1TVV15R0EEWQ
2,"It was my first time trying Turkish food. I am a very picky eater but I am always willing to trying new foods. 

My friend and I had a full appetizer spread...",4,2019-12-01 13:09:30,420,ugYhnKrr3Q1TVV15R0EEWQ
0,"I almost don't want to leave a review because I don't want them to get too popular.
This is pre made African food, what country specifically I wouldn't...",5,2020-03-02 08:56:35,81,L3PwWn54PvHm5Rd4oUg7xw
1,"If your in the Herald Square area regularly you should try this place sometime despite the interior. They only take cash or credit card, their Apple Pay...",3,2019-08-07 10:46:17,81,L3PwWn54PvHm5Rd4oUg7xw
2,"Pretty great no-frills place to have a hearty meal.

The staff is super friendly and the food is pretty cheap. You get a variety of different dishes and the...",5,2019-07-31 13:48:26,81,L3PwWn54PvHm5Rd4oUg7xw
0,"WOW. I'm shook. 

This place is amazing. The cocktails are bomb and all of the food was delicious. We ordered four dishes for sharing: guac and chips,...",5,2020-02-21 11:02:13,240,PqqnNrUtU7XTKQvUM4cyqQ
1,"Came here for a group brunch. It has a good vibe and the staff was very friendly and helpful, but I wasn't impressed with the food.

The start and the end...",3,2020-02-03 08:29:13,240,PqqnNrUtU7XTKQvUM4cyqQ
2,"I liked this place for an easy night out downtown with the friends. Vegan Mexican food doesn't initially sound like it's a hit for everyone, but the food is...",5,2020-01-18 15:16:18,240,PqqnNrUtU7XTKQvUM4cyqQ
0,"By far the best Thai food in the area.

They're pick up only, although I think they do Uber Eats as well.

Favorites are pad see ew, chicken steamed...",5,2020-02-27 17:30:01,384,7lhmzhkct9-blnuBAp_HVQ
1,Got red curry with beef through Ubereats and I'm convinced I've never eaten more terrible Thai food in my life before. It tasted like red curry flavored...,1,2020-03-09 20:43:48,384,7lhmzhkct9-blnuBAp_HVQ
2,The guys in the session ordered a bunch of food from this location... I didn't know where it came from at first but I realize it was and tore up my meal....,4,2019-12-14 15:11:22,384,7lhmzhkct9-blnuBAp_HVQ
0,For a corporate cafeteria Cafe 22 is really on point for both breakfast and lunch! They post a calendar with the meals for the month and change it up pretty...,4,2017-09-29 04:43:12,13,_kaQarBVxm8rHnyeFlCwTQ
1,"Normally go here when I don't feel like leaving the office, or have a meeting around lunch. Pretty cheap sandwiches and salads. For work cafeteria's this is...",4,2016-04-23 23:12:39,13,_kaQarBVxm8rHnyeFlCwTQ
2,"Cafe 22 has been on point recently. The variety of options and flavors is well above average for a corporate cafeteria.

The hot food options are very...",4,2016-07-18 10:15:44,13,_kaQarBVxm8rHnyeFlCwTQ
0,I tried mutton dum biryani and it was up to the T. Succulent goat pieces and biryani rice was also flavorful. I requested for additional bone marrow pieces...,4,2020-02-27 06:07:16,182,2KCyOxOM5J9glFSpmLqb9Q
1,"WORST DELIVERY EXPERIENCE. Worst Indian restaurant on Newark Ave. 
Ridiculous. Placed take out at 7:15. Expected delivery was 8:30. Long, but okay....",1,2019-11-30 18:38:50,182,2KCyOxOM5J9glFSpmLqb9Q
2,"Ordered butter chicken (12.99$) and special chicken soup (5.99$)
Butter chicken is terribly sweet (2/5)
Special chicken soup is -3/5) the only issue with...",2,2019-11-19 18:32:59,182,2KCyOxOM5J9glFSpmLqb9Q
0,I've only ordered the Lamb vindaloo and the Lamb Saag. They were both amazing! Really authentic and filling. Yes it's a little pricey but it feels worth it.,5,2020-03-11 09:42:13,68,0_ONgLkWOmGnjhCecpZPYQ
1,"Veggie Biryanis: Specified vegan for the dish yet received Paneer cheese chunks mixed in rendering me unable to enjoy it.  

Masala Dosa: least appetizing...",2,2019-10-16 17:18:30,68,0_ONgLkWOmGnjhCecpZPYQ
2,"I love the samosas here! My office orders from here all the time - we get all the different kinds of samosas, chicken Tikka masala, paneer tikka masala and...",4,2019-09-03 14:07:34,68,0_ONgLkWOmGnjhCecpZPYQ
0,"I've come here so many times, you have no idea! Despite them having several vegan-friendly options, I always get Shireen Palow or a different rice dish with...",5,2020-03-07 11:17:29,352,S37Fd4Jrwuv6R1DukmlqSQ
1,"I grew up in Oman. Its quiet and its laid back. 

A sheesha (or hookah as America knows it) place is as much about the vibe and the feelings and memories it...",5,2019-09-06 12:01:03,352,S37Fd4Jrwuv6R1DukmlqSQ
2,"yum.  So many delicious lamb curries, rice with spinach,  naan bread, biryani, kebabs.   light spicy ethnic curries.   All food delicious.   Price very...",5,2020-02-20 17:29:45,352,S37Fd4Jrwuv6R1DukmlqSQ
0,"If you have a hankering for delicious, authentic Indian cuisine, Mughlai Indian Cuisine is just the spot! This modest establishment boasts friendly staff,...",5,2020-02-28 22:29:01,67,ECUTH1VOWxZ9GwfzblMKzA
1,"Wonderful service wonderful food! 

The manager/owner was incredibly friendly and attentive. 

We had chicken curry, tandoori vegetables and a paneer...",5,2020-02-15 15:38:38,67,ECUTH1VOWxZ9GwfzblMKzA
2,"Love this cozy Indian spot, their newest location tucked into the Theatre District. 

The must-gets:
- the masala chai: oh my gosh, glorious, sweet, spicy,...",5,2020-02-08 14:50:39,67,ECUTH1VOWxZ9GwfzblMKzA
0,"Ordered from here via caviar bc I was craving grilled chicken, I got the platter and my husband got the pita sandwich. Compared to oasis which is also...",2,2019-10-06 18:19:57,167,7UJRw4Klt5yfE7q9vznEHA
1,"what a waste of $19. we ordered falafel sandwich specials which are supposed to be $13 total, but the lady who got my order said $15 over the phone. I asked...",2,2018-09-09 09:41:41,167,7UJRw4Klt5yfE7q9vznEHA
2,"After reading the reviews, I thought maybe we should definitely try this spot. I ordered through Caviar, we just received our food and are extremely...",1,2019-01-28 13:12:57,167,7UJRw4Klt5yfE7q9vznEHA
0,"My boyfriend and I are both weekends and we studied abroad in Japan together about three years ago. Since then, we have been on the hunt for the best Ramen...",5,2020-02-27 05:21:49,162,oy_FqW6XO8S06pg6nHbhog
1,"Appreciate the effort but disappointed. 

Friday 7pm 
There's a steady flow of customers with approx couple of empty seats at all times. 

You order at the...",3,2020-02-29 15:37:39,162,oy_FqW6XO8S06pg6nHbhog
2,"This is my first time eating vegan ramen, it's not too bad. I just wasn't full after my meal lol normally I'm full after one bowl. It felt more like a snack...",3,2020-02-19 16:50:44,162,oy_FqW6XO8S06pg6nHbhog
0,"I've been to this place several times, it's a small restaurant with maybe 10 tables or less. Meat is freshly grilled upon your order and the seasoning is...",5,2020-02-23 17:03:42,150,qf098TQ-Frxq4QyrlYqDJw
1,Folks in the neighborhood had always raved about this place .  I don't know why I had not gone in before today but going in today has made me to want to be...,5,2020-02-26 13:20:39,150,qf098TQ-Frxq4QyrlYqDJw
2,I get delivery from here! Everything is always warm and delicious. I wish they would send more bread; especially ordering the cacik. The cacik comes in a...,4,2019-07-14 13:07:55,150,qf098TQ-Frxq4QyrlYqDJw
0,This place has very good starters. Their gobi chilly has won a  special place in my heart. The variety of biryanis is just too good. The taste is even...,4,2020-01-24 08:29:54,465,5iKAeJ8RVrNGRUNy-355jQ
1,I used to be a regular to this place for their chicken biryani. But not anymore. The last two times have been the worst experiences I've had in a...,2,2019-11-16 08:06:33,465,5iKAeJ8RVrNGRUNy-355jQ
2,"COMPLETE RIP-OFF!!! I literally feel like I've been stolen from. I ordered chicken biryani for $13.99, I got about 2 1/2 cups of rice and a drumstick....",1,2019-11-09 17:16:46,465,5iKAeJ8RVrNGRUNy-355jQ
0,Tiki bars are my favorite type of bars!! I'm so glad I came across this spot on Yelp and decided to go. The drink that really caught my eye was the cocktail...,5,2020-03-18 16:49:07,429,Hgc27X2PX2jZQMcVtbJ9vQ
1,"I love a good tiki bar, and Mother of Pearl can certainly hang with the best of 'em. 

Cocktails are a bit pricey ($16+), but they are fun and fabulous. My...",4,2020-03-05 08:44:12,429,Hgc27X2PX2jZQMcVtbJ9vQ
2,Never been a big fan of alcohol but I passed by seeing the Shark sign so I had to order one. It was as good as I imagined and the red syrup wasn't something...,5,2020-02-26 11:05:51,429,Hgc27X2PX2jZQMcVtbJ9vQ
0,Amazing authentic Trinidadian food in the heart of brooklyn. I usually get doubles and a shrimp roti with side of tamarind and a sorrel to drink. The...,4,2020-02-25 13:26:46,142,AKaO-EaJ8EgUnx5EPZ8N4g
1,"This place made some really legit roti, I must say! 


I went here w/ my former BF in high school (the memory lasted more than the friendship now) but I...",3,2019-11-26 00:01:02,142,AKaO-EaJ8EgUnx5EPZ8N4g
2,"Update: Boneless chicken curry was delicious. Highly recommend.

Note: Went Sunday at 1:40pm and they did not have any channa (so no doubles and none in the...",5,2019-10-13 23:49:46,142,AKaO-EaJ8EgUnx5EPZ8N4g
0,"This is a great lunch option. Their lunch special is only $9, but you will be extremely full. The combination platter includes a lot of different items, all...",4,2013-09-13 18:02:50,1,AJjQwst3ppWZ9BCfk-tQPA
0,Night Music is an exotic vegetable fusion restaurant and sister bar to Ladybird located right next door. The lively atmosphere and unique menu is a perfect...,5,2020-02-26 08:53:58,34,dCcO8zw1xTgPs0HIHbiksA
1,"Like its sister restaurant Ladybird, what the food lacks for in flavor and execution is made up with a ton of salt and deep frying.

I came to Night Music...",3,2019-12-17 07:53:22,34,dCcO8zw1xTgPs0HIHbiksA
2,"I was recommended to Night Music by a manager at Ladybird. After going to Night Music several times, I decided to have my birthday with 24 guests there....",5,2019-12-13 12:09:10,34,dCcO8zw1xTgPs0HIHbiksA
0,"I can see why this place is highly rated! The food is full of flavor! I was amazed how tasty the Biryani is! 
Customer service is terrific there! They were...",5,2019-10-26 09:20:23,34,IbrIwIZ8f3IU5bQUZrfOYg
