,Review,Review Rating,Time,Total Reviews,Business ID
2,"The food is SO good, I've taken none vegans who also love it and enjoy the cocktails.

What no one enjoys is the massive cue, there might not even be a line...",3,2020-03-16 09:07:04,605,l4fwf8VwAokv3MWT45Ab7g
0,Fabulous service and food. Could only snag a 9:30 reservation but it was worth the wait. Highlights were the kabocha squash dumplings and tofu skin pockets...,5,2020-02-09 17:26:22,552,DodCeSN_hkXCJDoJ0uVxKg
1,"Surprisingly delightful! To be honest, I was skeptical coming here at first. I'm not a vegan or vegetarian but I'm generally open to new experiences so...",4,2020-03-12 21:26:13,552,DodCeSN_hkXCJDoJ0uVxKg
2,"Delish meal to end a museum day.  Mr & I had reservations & were seated right away

Advised plates were meant for sharing, we ordered a few dishes to ensure...",4,2020-02-29 05:43:10,552,DodCeSN_hkXCJDoJ0uVxKg
0,"Was just here for the grand re-opening, and my boyfriend and I had a fantastic experience. The service was very attentive and friendly. The owner also had a...",5,2019-10-20 10:38:33,122,Z2qZSs6oVJQFSc44tytAHg
1,Food is very good - but it doesn't come.  First time we ordered the delivery took nearly two hours - fine things happen sometimes.  Called tonight and...,1,2020-03-26 17:39:30,122,Z2qZSs6oVJQFSc44tytAHg
2,"Once again, my desire to try new things has backfired. Kitchen Grill on Fulton is my typical go-to for Indian food, but the positive Yelp reviews lured me...",3,2019-05-29 17:23:38,122,Z2qZSs6oVJQFSc44tytAHg
0,"Amazing place for South Indian food!

Must try - Dosa. Authentic and the variety of sides are amazing.",4,2019-12-09 07:59:51,309,o5sUOmtzcHAeSWtUuFJ00g
1,"Was really craving some good Kerala food and found the perfect place for that! 
Kerala is a coastal state in Southern India which is famous for their...",4,2019-10-08 21:59:00,309,o5sUOmtzcHAeSWtUuFJ00g
2,The level of careless laziness and rudeness in the staff is unbelievable. The lady who showed us to the table hung around to take our order and after we...,1,2019-08-04 16:14:30,309,o5sUOmtzcHAeSWtUuFJ00g
0,"Had a fabulous brunch at Pongal. Highly recommend the: 
1) fried idli appetizer
2) onion rava dosa (amazing crispy texture!)
3) the rice pudding for dessert...",5,2020-02-24 13:41:41,465,gWuHmSQ8G5FiKv-rEogwvA
1,This place used to be the GOAT of South Indian cuisine until more places popped up and I moved to Queens thus was closer to my one and only Sumadra...,4,2020-01-20 16:27:50,465,gWuHmSQ8G5FiKv-rEogwvA
2,"I stumbled into this restaurant after perusing the four, yes four, other Indian restaurants on the block. This one caught my eye for its lovely decor and...",5,2020-01-14 14:36:23,465,gWuHmSQ8G5FiKv-rEogwvA
0,"This is my new favorite Indian in the area.

Lamb tandoori was excellent.  One of the best prepared lamb dishes that I've had in a while.  Nice size...",5,2020-02-24 05:14:12,29,UiG3MlLDMMZp31XDBM2kvA
1,"Decided to give this place a shot while walking on 9th Avenue. Been to few Indian spots around and wanted to try a new spot. Walked in, the place was...",3,2020-01-29 23:10:38,29,UiG3MlLDMMZp31XDBM2kvA
2,"So disappointed with this place- I want it to be good so badly! We ordered jalfrezi, which was literally butter chicken that just had some extra veggies...",2,2020-04-11 15:55:18,29,UiG3MlLDMMZp31XDBM2kvA
0,"Certainly one of the best places to have a healthy meal.  The food is nice and tasty, with a nice range of spice levels, from beginners mild to the pros...",5,2020-02-02 11:48:28,116,ciIoPi0WqaNyB6xkwRKxzA
1,"Love this place! Has quickly become my go to in the midtown area for lunch. Don't expect anything fancy, this is a counter service/hot bar spot with a few...",5,2020-01-16 11:50:53,116,ciIoPi0WqaNyB6xkwRKxzA
2,"I cook my own Indian food, and found this place to be very satisfying.  The service is friendy, and the lunch special is unbeatable.",5,2020-01-21 09:21:08,116,ciIoPi0WqaNyB6xkwRKxzA
0,"Decided to visit this place for their lunch buffet when I had a friend in town and all I can say is WOW! The food was great, and the staff was phenomenal....",5,2020-02-25 22:05:34,50,shp52ABKmbCEOB4dku0low
1,"The interior of the restaurant is a dump.  The pictures on yelp do not accurately reflect the sadness of the actual interior.

Lunch buffet is now $14.95...",3,2020-02-24 05:08:43,50,shp52ABKmbCEOB4dku0low
2,"I'm not sure what other Indian buffets these reviewers have tried, but I'm sad for those who think this is a 4 or 5 star experience. Especially for NYC,...",3,2019-12-17 12:02:32,50,shp52ABKmbCEOB4dku0low
0,"I was shocked that ratings of this restaurant are so low. I was gonna write a 5 star review, but when my dinner arrived and I've got to taste it, I am...",4,2018-11-21 21:10:29,146,sQ_L8O9WMU4apxSTVa9JKg
1,Haven't been in the place and never will. I witnessed a possum pop out of their side walk cellar last night. Their sanitary grade is pending and after...,1,2020-02-23 10:52:20,146,sQ_L8O9WMU4apxSTVa9JKg
2,Be warned someone recently found a roach in the chicken tika masala. Completely disgusting and unacceptable. I felt obligated to write this post so others...,1,2019-11-13 05:27:32,146,sQ_L8O9WMU4apxSTVa9JKg
0,"Simply the BEST Indian restaurant in all metro area!

I love Indian food but most restaurant to the food is spicy to the point that it overwhelms the...",5,2020-02-15 09:34:13,627,niivJKBqY5wToDukqZHetQ
1,"I'll preface by saying that I don't eat a ton of Indian food, so I may not know what ""good"" or ""authentic"" Indian food tastes like. 
That said, this has...",4,2020-02-16 18:03:31,627,niivJKBqY5wToDukqZHetQ
2,My last update was from 2012. I stand by what I originally wrote. Delivery has gotten better. I use Seamless and it isn't as bad as it used to be. It is...,4,2020-01-18 07:48:25,627,niivJKBqY5wToDukqZHetQ
0,I've always heard of this place and decided to stop and try it on my way to Henry's rooftop bar with my family. The inside is trendy yet nostalgic. The...,4,2020-01-28 03:46:33,871,kB3QyyhHFVyhGgp35Rnuew
1,"Not sure why this place gets to much hype!

It's not the worst but it is average at best  and doesn't hit the spot! 
 

The staff are very nice though so...",3,2020-01-22 08:20:08,871,kB3QyyhHFVyhGgp35Rnuew
2,"As someone who lives in California, The Kati Roll Company is a place I have to try whenever I'm in NYC. It is delicious and the quality of the food hasn't...",5,2019-12-30 17:55:24,871,kB3QyyhHFVyhGgp35Rnuew
0,Love love love this place and they are just so nice!! They deliver further than the norm too,5,2020-02-23 03:16:31,201,9y6UQ2GYKe08-WF_1jTX0A
1,"Found SEVERAL HAIRS in both the curry and the rice dishes that we ordered. I have eaten here before and have enjoyed their food previously. However, this...",1,2020-04-12 12:28:55,201,9y6UQ2GYKe08-WF_1jTX0A
2,"2 people I saw come from the kitchen were not wearing gloves.... During these crazy times - that's insane. 
Used to really like this place, but there...",1,2020-04-01 16:37:06,201,9y6UQ2GYKe08-WF_1jTX0A
0,A friend of mine who happens to live a few blocks away brought me here on my Friday evening after work rant of wanting to have some good Indian food. Upon...,5,2020-03-03 16:51:02,89,Rk6TXh7nINbzJoGtI2C5cA
1,This has turned into one of my go to take out spots when I'm feeling too lazy to cook. I've tried a few of their kati rolls and their panneer tikka masala....,4,2020-02-06 10:27:34,89,Rk6TXh7nINbzJoGtI2C5cA
2,"I've ordered from here numerous times and always order the same thing, lamb biryani for $13 and one chicken biryani for $11.50. Today What I got was totally...",1,2019-12-26 14:58:38,89,Rk6TXh7nINbzJoGtI2C5cA
0,"I could literally eat Modern Love's mac & cheese every day forever and die happy!! 

I sincerely hope all of you will stay home though, because it is...",5,2020-03-16 10:55:44,495,BYnd0Kbkrjhz0CGKMF1lqg
1,MODERN LOVE BROOKLYN IS BY FAR ONE OF MY FAVORITE FAVORITE FAVORITE VEGAN RESTAURANTS. I wish any carnivore would come here and see that vegan food is not...,5,2020-03-09 07:13:24,495,BYnd0Kbkrjhz0CGKMF1lqg
2,"The menu has been updated since the last time I dined here. Different vegan dishes, but that same quality and taste. You can trick a carnivore into eating...",5,2020-02-27 11:03:53,495,BYnd0Kbkrjhz0CGKMF1lqg
0,"Overall, I would suggest this place to anyone.  I liked the atmosphere, service and food. You definitely get what you pay for. 3 appetizers, 1 side and 2...",4,2020-02-03 05:09:50,220,ZkpKRf_AenlKegg2-NSA3g
1,"You've walked by this place a dozen times and been like ""wow that's a lot of lights."" You'll be surprised to know that inside, there are even more lights....",3,2019-11-16 11:03:58,220,ZkpKRf_AenlKegg2-NSA3g
2,Thoroughly DISGUSTED by this place to the point it is making me DELETE my SEAMLESS account! Yes it's that bad to the point I have decided to part with my...,1,2020-03-29 18:12:31,220,ZkpKRf_AenlKegg2-NSA3g
0,"If you're looking to get filled with Indian food full of flavor at a great price I would definitely recommend this place. The lunch deal is worth the value,...",5,2020-01-06 09:15:05,569,RdETxi25tbocKIcMiW5TxQ
1,"Where do you go when you need a reservation for 22 people and you want to make sure some ""first-time"" Indian food diners have the best experience? Look no...",5,2019-12-24 04:47:40,569,RdETxi25tbocKIcMiW5TxQ
2,"Arhwyn was our waiter, and he was fantastic. He was so polite, and truly cared about our experience. He was very thoughtful, and interactive. We had two...",5,2019-10-24 17:53:51,569,RdETxi25tbocKIcMiW5TxQ
0,This is one of the better Indian restaurants in Manhattan. They have a lunch buffet which had plenty of vegetarian dishes and a goat curry as well. The naan...,4,2020-01-15 19:44:08,156,_RVeBqIldnrh757oxL-b7w
1,Came for Lunch Buffett. Nothing great about food. Chicken was very hard in appetizer and Chicken tikka masala curry. Veg items also not that great tasting....,1,2019-11-29 17:18:07,156,_RVeBqIldnrh757oxL-b7w
2,"Another one bites the dust.

Tonights order was just plain gross. 

The Chicken Tikka Masala was very spicy but completely flavorless (they left out the the...",2,2019-10-14 16:05:52,156,_RVeBqIldnrh757oxL-b7w
0,One of my favorite food places in NYC. Kati rolls are AMAZING and you can get an order of 2 for $6. There's something special about the paratha bread- it's...,5,2020-01-11 18:40:01,160,4x4M_p_b8GvLkc4fe00GHA
1,"(This was originally posted on Indian King Biryani House cart...moved it here to its rightful spot, oops!) 
---
Came here today on 11/27/2019 with a...",4,2019-12-14 15:35:01,160,4x4M_p_b8GvLkc4fe00GHA
2,"Holy God. These Kati rolls. They're savory, protein laden gems with a kiss of sweetness as if to say ""you don't have to settle for anothwr bad lunch ever...",5,2019-10-24 14:17:10,160,4x4M_p_b8GvLkc4fe00GHA
0,"The falafel sandwich is worth every penny.
Seriously made my (very rainy) day.
Go for either the spicy (it's not too spicy) or regular falafel sandwich,...",5,2020-01-27 08:21:34,1523,j0n_poMVZnODYOFviLbh0Q
1,"A solid spot for inexpensive Middle Eastern fare. Their core options include falafel or veggies served inside a pita, as part of a salad, or as part of a...",4,2020-03-07 07:16:34,1523,j0n_poMVZnODYOFviLbh0Q
2,"Walked past this place on our way uptown. Sure enough - I see a sign for impossible kebab?! I ran inside! 

My girlfriend and I are both vegetarian and...",5,2019-12-29 15:21:31,1523,j0n_poMVZnODYOFviLbh0Q
0,"Honestly if you're in the area and looking for something quick and inexpensive, then Curry Express is going to be your best friend. The food isn't the best...",5,2019-10-30 13:39:53,228,7k2uvrFxOoBwV7c2m0UBNw
1,"I don't know if it has changed management and/or ownership over the years, but I have been coming here for more than 25 years, and on every visit I have had...",5,2020-03-13 13:20:25,228,7k2uvrFxOoBwV7c2m0UBNw
2,"I'm Indian and this food is not even remotely close to authentic Indian food. It's bland, stale and just terrible. Two bites and I ended up trashing my...",1,2020-03-05 17:16:53,228,7k2uvrFxOoBwV7c2m0UBNw
0,"I'm glad I found this tiny gem in Manhattan. 
I don't eat Indian food a lot. But I'm so happy I came to this place. The service was good and the food is...",5,2019-12-22 08:07:15,456,izRJeBfDQYJmd6ibIQ6Mfg
1,"We had such a great time at Mughlai! Went here for a double date on a Friday night. We tried to go to Drunken Monkey, but it was completely full for the...",4,2019-11-02 13:04:37,456,izRJeBfDQYJmd6ibIQ6Mfg
2,"Try: Mughlai Special ($15.95) comes with an appetizer, entree, and naan bread. I ordered via delivery: Samosa, Chicken Tikka Masala, and Naan Bread. Dang...",4,2019-10-14 18:00:26,456,izRJeBfDQYJmd6ibIQ6Mfg
0,"Really solid Yemini cuisine. The flavors are rich and well developed. 

I have only ordered from here so far but I will try to make it to the restaurant (in...",5,2019-12-06 17:59:45,80,bNO0801dOoSSFJuDdTDzYQ
1,"This is now our backup Yemeni restaurant when Yemen Cafe is rammo. 

We had their grilled chicken which wAs good but not great. Note that the rice is not as...",3,2019-11-01 20:00:26,80,bNO0801dOoSSFJuDdTDzYQ
2,"My husband has ordered from here several times, and it has always been surprisingly delicious. We have enjoyed their lamb dish, the baba ghanoush, bread,...",5,2020-02-21 11:24:03,80,bNO0801dOoSSFJuDdTDzYQ
0,"While I'm still a little peeved at my last service encounter here in December (see below), I have to admit the food is still excellent here. And I...",5,2020-03-13 16:41:32,303,fjjzAn0j6zCs2SNViuNfwQ
1,"As an Indian who has been to many North Indian restaurants, this is mediocre quality and overpriced. It's name brand is a holdover from years ago when it...",2,2020-03-07 19:54:20,303,fjjzAn0j6zCs2SNViuNfwQ
2,"We came here on a snowy New York night. Tried a lot of different varieties (thanks to our super large group who know sharing is caring)

Manchow Soup:...",4,2020-01-18 18:57:22,303,fjjzAn0j6zCs2SNViuNfwQ
0,"Amazing price for this chaat buffet on wednesday night, 12.99$
It has bhelpuri, paani-puri, pav bhaji, pakora, biryani, idli sambhar and halwa. Special...",4,2019-11-20 17:53:29,434,NqnCmOlPIJ_QBQzvZ28djA
1,"Attitude is something we as customers take it for granted. When it is served right, we don't realize and only when a business shows the other side to us, we...",1,2020-02-15 07:16:38,434,NqnCmOlPIJ_QBQzvZ28djA
2,"Eeehhh Sapthagiri is okay, but for me, there are much better places to eat in the area. 
The food is all vegetarian (not vegan) and there's no BYOB or bar...",3,2020-02-14 11:37:29,434,NqnCmOlPIJ_QBQzvZ28djA
0,This is a take out review because I've never actually been in the restaurant but OH MY GOD this is hands down my favorite Indian in the city. We also order...,5,2019-05-05 12:02:09,145,NHoKf98A1Hi8htHEfeptgw
1,"Hate to give one star, but highly disappointed by Sapid Indian Restaurant. Ordered food through seamless and based on the price I was expecting some high...",1,2019-08-11 20:24:35,145,NHoKf98A1Hi8htHEfeptgw
2,"- Really fast service
- kind of expensive
- I got three meals off my one order",3,2018-11-16 08:53:36,145,NHoKf98A1Hi8htHEfeptgw
0,"OUTSTANDING SERVICE! INCREDIBLY TASTEFUL. The servers were so polite and always made sure we had enough water, helped us pick out what we wanted, answered...",5,2020-03-11 05:58:47,18,RZQDDJBb7X417wcobUyv0g
1,"Wtf? Who dumps sugar in chicken tikka masala? That's what London Tandoori's tastes like. Orange, syrupy sauce with a few pieces of chicken in it. No flavor....",1,2020-04-02 18:52:27,18,RZQDDJBb7X417wcobUyv0g
2,"Delicious. Fast. Fresh. Very well seasoned Indian food. Better than other places nearby. Arrived hot and on time.

Update: my only Indian take out place....",5,2020-03-04 13:20:31,18,RZQDDJBb7X417wcobUyv0g
0,"Very good Indian food in Time Square.  
Slow service...
But you look past it because of the wonderful food!  We will be back !",5,2019-12-31 05:57:16,58,raGF9jAO7JOiIbFQ2_bTAg
1,Maybe I just ordered the wrong thing. Waiter recommended the Goan fish so I got it. The fish was cooked well (slightly crispy on the outside but soft and...,3,2020-02-22 16:07:40,58,raGF9jAO7JOiIbFQ2_bTAg
2,"Conveniently located restaurant with a pleasant ambience. 

It was  great having a parking garage right next door as I was driving into the city from NJ for...",4,2020-02-11 15:05:35,58,raGF9jAO7JOiIbFQ2_bTAg
0,"I always get the chicken biryani bowl for lunch. Basically two meals in one. A BOGO. So flavorful. Been a few times, have yet to be disappointed.",5,2020-01-31 10:35:15,143,-mQG7oEHSAMr9dBDrrqI2g
1,"TL;DR: I do not recommend eating here, unless you only want Raita. Avoid the ""Kati Rolls."" 

Note - the ""normal"" food here runs spicier than average, but...",2,2020-02-07 10:22:32,143,-mQG7oEHSAMr9dBDrrqI2g
2,"First time I went in here was for lunch with my colleagues to get a Togo. There was a big line and we awaited our turn, quickly went through the menu and...",3,2019-10-20 10:17:20,143,-mQG7oEHSAMr9dBDrrqI2g
0,"I haven't been to this place since December, which is when I visited NY. But right now, I'm sitting in bed thinking about the absolutely delicious food I...",5,2020-03-10 17:18:08,615,noBCTbD1Ylf5QR7PXy-rkA
1,This place is outstanding.  I've tried several items on the menu and I have trouble deciding between my favorites when I go.  They have dishes that are...,5,2020-03-08 09:06:18,615,noBCTbD1Ylf5QR7PXy-rkA
2,This place looks like a hole in the wall from the street - nothing too impressive. Don't be deceived. Seriously. Do not judge this place by its exterior....,5,2020-01-24 16:29:53,615,noBCTbD1Ylf5QR7PXy-rkA
0,Cannot say enough AMAZING things about this place! Have been looking for a favorite Thai place in NYC forever and finally found it. This place was so...,5,2020-01-31 13:58:16,61,g4EXxoV0z_TnyWF8h9xMKQ
1,"A great vegan Thai joint that even a meat eating person like myself enjoyed. 

Came here with 2 vegetarian friends who luckily hawked they menu beforehand....",4,2020-02-21 22:03:28,61,g4EXxoV0z_TnyWF8h9xMKQ
2,"Got takeout - pad Thai and the tom kha soup.

Pros:
- Timely delivery
- Nice to have a vegan friendly Thai place :)
- Just right portion sizes

Cons:
- The...",4,2019-12-23 16:53:40,61,g4EXxoV0z_TnyWF8h9xMKQ
0,This place first came to my attention when I was looking for some chaat menu items; I lived in the SF Bay Area for a while and it seemed like there were...,4,2020-03-19 20:42:02,304,YM5AbOOg-TjuHJrQmfd0Hw
1,"No matter how rough the service is, the food just keeps on getting better all the time.

Even though there was a big delay with delivery tonight, the food...",4,2020-01-19 19:59:42,304,YM5AbOOg-TjuHJrQmfd0Hw
2,The starter Pani Puri has no flavour. The  puri is not real Puri from India. The presentation is also very bad. I am really surprised at the rating and...,1,2019-11-30 17:27:56,304,YM5AbOOg-TjuHJrQmfd0Hw
0,"Really great food! The waiter was really nice and we didn't have to wait long at all for the food.

It was quiet for a Friday night (we came at around 7pm)....",4,2020-01-10 20:52:33,68,KJNXC2NtxRPeu_nkk1PC4A
1,"Early afternoon on a weekend, it was eerily silent and dark.  Ordered the beef momos, shabhalap, ghabrha, and a side of tingmo; the chicken lollipop and...",4,2020-03-08 14:18:11,68,KJNXC2NtxRPeu_nkk1PC4A
2,"Clean interior, very sweet and pleasant service. Prompt and courteous.
Tried the Boja (tea with butter and salt), Limbu Pani (lemonade), for appetizers we...",5,2018-12-01 21:55:42,68,KJNXC2NtxRPeu_nkk1PC4A
0,"We were super hungry and needed to eat, but also had to watch GBBS (great british baking show) and do our face masks. So, we decided to hit up GH and get...",4,2019-12-14 12:01:11,408,oSMFe-10TyH40NIXG0Zahw
1,"I ordered  from here tonight for takeout and the food was excellent.  I didn't expect much, but the garlic naan, chicken tikka masala and chicken makhani...",5,2020-04-04 21:23:57,408,oSMFe-10TyH40NIXG0Zahw
2,"I ordered a veg noodles, mutton biryani with haryali kebab, momo and badam halwa. I would say most of the items were very old doesn't taste fresh , biryani...",1,2020-04-04 15:07:32,408,oSMFe-10TyH40NIXG0Zahw
0,"Traveling as a family, we were looking for good food close to our rental. The challenge is finding gluten free vegetarian that my daughter can eat and a...",4,2019-11-15 15:41:55,64,KtYEMI-_zy5hoZTBd3i3Tw
1,"...I paid how much for what? $40 for one person. 

Rogan Josh 14.99, tasted fine, but portion was quite small and rice was really dry.

Gobi manchurian...",2,2020-01-26 09:04:46,64,KtYEMI-_zy5hoZTBd3i3Tw
2,"The food was great! So happy they could stay open during such a tough time, they made my night. Food was perfectly spiced and great portions, will...",5,2020-03-26 13:05:48,64,KtYEMI-_zy5hoZTBd3i3Tw
0,"UPDATE: Came back with my wife, and I'm happy to say that we both had a wonderful experience. 

We shared the Veg Sekuwa (grilled paneer & vegetables with...",5,2019-12-27 05:14:24,98,J0vr8Jpe9t7UgoybpbgkFQ
1,"Came with a friend who never had momos (what!), we had to come to support the local community.

There was no one there except 1 person, who looks like he...",4,2020-03-18 06:21:18,98,J0vr8Jpe9t7UgoybpbgkFQ
2,Wow. Absolutely incredible. I came here with my roommate and it was our first time having Nepalese food. The staff was so friendly and made great...,5,2019-12-08 12:51:22,98,J0vr8Jpe9t7UgoybpbgkFQ
0,"Came here for a Valentine's Day dinner on the 15th. I've been here before with my family and we just love it. 
It's hard finding good Gujarati food and this...",5,2020-02-18 09:20:54,646,3uEkZEAp7biQEtt0S7W1Vg
1,The BEST vegetarian Indian/Gujarati food I've had in New York. Very nice and central location in vicinity of Empire State Building. The seating area is far...,5,2020-01-19 15:51:53,646,3uEkZEAp7biQEtt0S7W1Vg
2,"Vatan is one of the last authentic New York dining experiences anyone can have in this town. I've been a fan since the 1990s.

The array of Vatan's colorful...",5,2019-12-08 17:44:27,646,3uEkZEAp7biQEtt0S7W1Vg
0,"Oooof.  It's a wonder to me how a place like this can even exist!!

The food is great quality, the portions are huge, and it's so CHEAP!

My go to at any...",5,2020-02-14 10:58:26,58,llzZ19xTIrueN5XBZi4zWg
1,Today I had the curry chicken instead of the usual mix chili over rice. It was good but not as good as that chili flavor. They did not have the Bihari...,5,2020-01-08 08:53:02,58,llzZ19xTIrueN5XBZi4zWg
2,Stopped by this cart after checking the World Trade Center. Located in the same vicinity as the gigantic red cube structure. We wanted to get the shish...,5,2019-12-23 14:58:19,58,llzZ19xTIrueN5XBZi4zWg
0,Wow wow the pizza here is amazing! My husband and I wanted pizza delivery but didn't want anything greasy or with the usual pizzeria toppings. We saw this...,5,2020-02-06 06:59:23,481,oqVG2LsTwvRzgJxId5pqiw
1,always good. Service ok. Food delicious. Nice interior. We've been here before and this time brought friends.  Everyone enjoyed their meal. I thought the...,4,2020-02-18 08:16:17,481,oqVG2LsTwvRzgJxId5pqiw
2,Brunch (not bottomless) review. Came here on a Saturday 12:30 with no reservations. The manager/host was very nice in helping us find a table with a short...,3,2020-02-16 11:42:28,481,oqVG2LsTwvRzgJxId5pqiw
0,This is a spot we come back to again and again because the food is so good and reasonably priced. The Chai's always hits the spot. Everything they serve is...,5,2019-10-11 12:58:29,72,RRwz0t3XcaMCSjTWDy3C9A
1,"Ok so for food this place needs to shut down
Has B sanitation grade already. Waited for 30 mins for beef nihari when the restaurant was not even crowded....",4,2019-03-16 13:05:58,72,RRwz0t3XcaMCSjTWDy3C9A
2,I order from this place online time to time and it's always good. My only issue though is that the kofta which was said to have eggs has no eggs in it. I...,3,2020-02-15 23:45:05,72,RRwz0t3XcaMCSjTWDy3C9A
0,"What service
What food
What ambience
What options

Unbelievably tasty and cheerful experience ! Loved it !
Owner takes care of the table personally whenever...",5,2020-02-22 19:10:53,1037,xemN4tP9RlK5c-yUT-M71Q
1,"GREAT QUESADILLA'S AND DRINKS!!!!


Me and my BF had a great experience here!! The food was so delicious, the drinks were bomb and the vibe was  chill and...",5,2020-02-07 05:16:23,1037,xemN4tP9RlK5c-yUT-M71Q
2,"Like others have stated, you can't always rely on user reviews.  You win some you lose some is what I like to say.  Here, we lost. 

We picked this joint...",2,2020-01-10 13:12:48,1037,xemN4tP9RlK5c-yUT-M71Q
0,"Me: *goes on Yelp, sees all the Thali photos, and knows I must come here.*

The thali is so great because you get a dosa, naan, or something else with a...",4,2020-02-14 21:41:37,787,ZrdTKStTAo2pchslOev1KQ
1,I am picky about Indian food - that's just coz I've been having so much of it!! The South Indian thaali was good but I just don't get why most restaurants...,3,2020-02-17 11:41:45,787,ZrdTKStTAo2pchslOev1KQ
2,I remember when this restaurant opened about  10-12 years ago. I used to live in NYC. It used to be called Tiffin Waala and was decent. Chennai Garden was a...,4,2020-02-12 22:24:16,787,ZrdTKStTAo2pchslOev1KQ
0,"There are no accidents; there are no coincidences. While my plan was to dine on Indian cuisine, I honestly did not look TAJ up. I actually search out...",5,2018-03-17 18:41:28,243,aczqK-esIyqhyk7QLqcc1A
1,"I really like the ambiance at Taj. Low ceilings, dim lighting, intimate booths, live sitar players, nooks and crannys everywhere. Everything is well worn...",3,2017-10-20 09:22:40,243,aczqK-esIyqhyk7QLqcc1A
2,Great spot. Food is Suttle and isn't as harsh as other Indian food spot. It maintains most of the taste you look for in Indian food. Staff is really nice....,5,2018-07-11 16:23:38,243,aczqK-esIyqhyk7QLqcc1A
0,"My boyfriend's family eats here all the time (they're Pakistani so this has a stamp of approval). There's soo many sweets piled up, tons of colors, looking...",4,2020-03-03 10:59:50,94,rML0mPoWQHxG8ifHGuI7pQ
